{
  "project": "Ví dụ ứng dụng ReactJS + ASP.NET Core",
  "project_type": "hybrid",
  "platforms": [
    "web"
  ],
  "technologies": [
    "react",
    "aspnet-core",
    "postgresql",
    "typescript",
    "ef-core"
  ],
  "features": {
    "deep_link": false,
    "push_notification": false,
    "auth": true,
    "crud": true,
    "search": true
  }
}
